<?xml version="1.0" encoding="UTF-8"?>
<!DOCTYPE settings SYSTEM "http://optimuz.interativadesenvolvimento.com.br/dtd/validation.dtd">
<form method="post" lang="">
	<input name="id" label="Id do ministério">
		<rule name="required" />
		<rule name="number" />
	</input>
	<input name="nome" label="Nome do ministério">
		<rule name="required" />
	</input>
	<input name="descricao" label="Descrição do ministério">
		<rule name="required" />
	</input>
	<input name="igreja" label="Ministério ou instituição">
		<rule name="required" />
	</input>
	<input name="status" label="">
		<rule name="required" />
	</input>

	<input name="arquivo" label="">
		<rule name="discard" />
	</input>
	<input name="nome-arquivo" label="">
		<rule name="discard" />
	</input>

	<input name="lider" label="Lider">
		<rule name="array" />
	</input>
	<input name="cargo" label="Cargo">
		<rule name="array" />
	</input>
</form>