<?xml version="1.0" encoding="UTF-8"?>
<!DOCTYPE settings SYSTEM "http://optimuz.interativadesenvolvimento.com.br/dtd/validation.dtd">
<form method="post" lang="">
	<custom-rules>
		<rule name="phone" regex="/\d{2} \d{4}-\d{4,5}/" errorMessage="O formato do telefone deve ser 00 0000-0000" />
		<rule name="cep-rule" regex="/\d{5}-\d{3}/" errorMessage="O formato do cep deve ser 00000-000" />
	</custom-rules>
	<input name="nome" label="Nome">
		<rule name="required" />
	</input>
<!--	<input name="email" label="E-mail">
		<rule name="required" />
		<rule name="email" />
	</input>-->
	<input name="telefone" label="Telefone">
		<rule name="phone" />
	</input>
	<input name="permissoes" label="PermissÃµes">
		<rule name="array" />
		<!--<rule name="number" />-->
		<rule name="discard" />
	</input>

	<input name="senha" label="Senha atual">
		<rule name="discard" />
	</input>
	<input name="nova-senha" label="Nova senha">
		<rule name="password" accept="letters,numbers,symbols" allowSequences="false" sequencesMaxLength="4" />
		<rule name="length" min="8" />
	</input>
	<input name="confirma-nova-senha" label="Confirme a nova senha">
		<rule name="comparePasswords" second="nova-senha" />
		<rule name="compareRequireds" second="nova-senha" differentValue="" />
	</input>
</form>