<?xml version="1.0" encoding="UTF-8"?>
<!DOCTYPE settings SYSTEM "http://optimuz.interativadesenvolvimento.com.br/dtd/validation.dtd">
<form method="post" lang="">
	<custom-rules>
		<rule name="phone" regex="/\d{2} \d{4}-\d{4,5}/" errorMessage="O formato do telefone deve ser 00 00000-0000" />

		<rule name="cep" regex="/\d{5}-\d{3}/" errorMessage="O formato do CEP deve ser 00000-000" />
		<rule name="long" regex="/^-?\d+(\.\d+)?$/" errorMessage="A longitude não foi informada corretamente" />
		<rule name="lat" regex="/^-?\d+(\.\d+)?$/" errorMessage="A latitude não foi informada corretamente" />
	</custom-rules>

	<input name="titulo" label="Nome fantasia">
		<rule name="required" />
	</input>
	<input name="descricao" label="Razão social">
		<rule name="required" />
	</input>
	<input name="igrejas" label="Lugar a apresentar">
		<rule name="array" />
	</input>

	<input name="arquivo" label="">
		<rule name="discard" />
	</input>
	<input name="nome-arquivo" label="">
		<rule name="discard" />
	</input>
</form>