<?xml version="1.0" encoding="UTF-8"?>
<!DOCTYPE settings SYSTEM "http://optimuz.interativadesenvolvimento.com.br/dtd/validation.dtd">
<form method="post" lang="">
	<input name="pesquisa-id" label="">
		<rule name="required" />
		<rule name="number" />
	</input>
	<input name="titulo" label="Título">
		<rule name="discard" />
	</input>
	<input name="data-inicio" label="Data de início">
		<rule name="date" />
		<rule name="compareDates" second="data-fim" />
	</input>
	<input name="data-fim" label="Data de término">
		<rule name="date" />
	</input>
	<input name="descricao" label="Descrição da Pesquisa">
		<rule name="discard" />
	</input>
	<input name="status" label="Descrição da Pesquisa">
		<rule name="discard" />
	</input>
	<input name="quantidade-pontos" label="Quantidade de pontos">
		<rule name="required" />
	</input>
	<input name="tipo-pesquisa" label="Tipo de pesquisa">
		<rule name="required" />
	</input>
	<input name="pesquisa-anonima" label="Pesquisa anonima">
		<rule name="required" />
	</input>

	<input name="sexo" label="Sexo">
		<rule name="discard" />
	</input>
	<input name="idade-minima" label="Idade Mínima">
		<rule name="discard" />
	</input>
	<input name="idade-maxima" label="Idade Máxima">
		<rule name="discard" />
	</input>

	<input name="id-categorias">
		<rule name="array"/>
	</input>
	<input name="categorias">
		<rule name="array"/>
	</input>
	<input name="id-perguntas">
		<rule name="array"/>
	</input>
	<input name="perguntas">
		<rule name="array"/>
	</input>
	<input name="alternativas">
		<rule name="array"/>
	</input>
	<input name="id-alternativas">
		<rule name="array"/>
	</input>
	<input name="tipo-resposta">
		<rule name="array"/>
	</input>
	<input name="novas-alternativas">
		<rule name="array"/>
	</input>
	<input name="novas-alternativas-img">
		<rule name="array"/>
	</input>
	<input name="options-removed">
		<rule name="array"/>
	</input>
	<input name="questions-removed">
		<rule name="array"/>
	</input>

	<input name="text-question" label="">
		<rule name="array" />
	</input>
	<input name="type-response" label="">
		<rule name="array" />
	</input>
	<input name="category" label="">
		<rule name="array" />
	</input>
	<input name="options" label="">
		<rule name="array" />
	</input>
	<input name="required" label="">
		<rule name="array" />
	</input>
	<input name="exception" label="">
		<rule name="discard" />
	</input>
	<input name="trigger" label="">
		<rule name="discard" />
	</input>
</form>