<?xml version="1.0" encoding="UTF-8"?>
<!DOCTYPE settings SYSTEM "http://optimuz.interativadesenvolvimento.com.br/dtd/validation.dtd">
<form method="post" lang="">
	<custom-rules>
		<rule name="phone" regex="/\d{2} \d{4,5}-\d{4}/" errorMessage="O formato do telefone deve ser 00 0000-0000" />
		<rule name="cpf" regex="/\d{3}.\d{3}.\d{3}-\d{2}/" errorMessage="O formato do cpf deve ser 000.000.000-00" />
	</custom-rules>

	<input name="nome-completo" label="Nome completo">
		<rule name="required" />
		<rule name="letters" />
	</input>
	<input name="email" label="E-mail">
		<rule name="required" />
		<rule name="email" />
	</input>
	<input name="rg" label="RG">
		<rule name="required" />
		<rule name="number" />
	</input>
	<input name="cpf" label="CPF">
		<rule name="required" />
		<rule name="cpf" />
	</input>
	<input name="celular" label="Celular">
		<rule name="required" />
		<rule name="phone" />
	</input>
	<input name="cadastro-senha" label="Senha">
		<rule name="required" />
		<rule name="password" accept="letters,numbers,symbols" allowSequences="false" sequencesMaxLength="4" />
		<rule name="length" min="8" />
	</input>
	<input name="confirmar-cadastro-senha" label="Confirmar E-mail">
		<rule name="required" />
		<rule name="password" accept="letters,numbers,symbols" allowSequences="false" sequencesMaxLength="4" />
		<rule name="comparePasswords" second="cadastro-senha" errorMessage="Confirmar cadastro senha"/>
	</input>
	<input name="tipo-cliente" label="Tipo de cliente">
		<rule name="number"/>
		<rule name="required"/>
	</input>
</form>