<?xml version="1.0" encoding="UTF-8"?>
<!DOCTYPE settings SYSTEM "http://optimuz.interativadesenvolvimento.com.br/dtd/validation.dtd">
<form method="post" lang="">
	<custom-rules>
		<rule name="phone" regex="/\d{2} \d{4}-\d{4,5}/" errorMessage="O formato do telefone deve ser 00 00000-0000" />
		<rule name="cep" regex="/\d{5}-\d{3}/" errorMessage="O formato do CEP deve ser 00000-000" />
		<rule name="cpf-rule" regex="/\d{3}.\d{3}.\d{3}-\d{2}/" errorMessage="O formato do cpf deve ser 000.000.000-00" />
	</custom-rules>

	<input name="nome-completo" label="Nome completo">
		<rule name="discard" />
	</input>
	<input name="rg" label="RG">
		<rule name="discard" />
	</input>
	<input name="cpf" label="CPF">
		<rule name="cpf-rule" />
		<rule name="cpf" />
		<rule name="discard" />
	</input>
	<input name="rg" label="RG">
		<rule name="discard" />
	</input>
	<input name="sexo" label="Sexo">
		<rule name="discard" />
	</input>
	<input name="usuario" label="Usuário">
		<rule name="discard" />
		<rule name="number" />
	</input>
	<input name="email" label="E-mail">
		<rule name="discard" />
	</input>
	<input name="telefone-residencial" label="Telefone residêncial">
		<rule name="discard" />
		<rule name="phone" />
	</input>
	<input name="telefone-celular" label="Telefone celular">
		<rule name="discard" />
		<rule name="phone" />
	</input>
	<input name="profissao" label="profissao">
		<rule name="discard" />
	</input>

	<input name="cidade-naturalidade" label="Cidade de nascimento">
		<rule name="discard" />
	</input>
	<input name="data-nascimento" label="Data de nascimetno">
		<rule name="discard" />
	</input>

	<input name="batizado" label="Batizado">
		<rule name="discard" />
	</input>
	<input name="data-membro" label="Data membro">
		<rule name="discard" />
	</input>
	<input name="filial" label="Filial">
		<rule name="discard" />
	</input>
	<input name="cristao" label="Cristão">
		<rule name="discard" />
	</input>
	<input name="nome-cargo" label="Cargo">
		<rule name="discard" />
	</input>

	<input name="participa-pg" label="Participa de PG">
		<rule name="discard" />
	</input>
	<input name="nome-pg" label="Nome da PG">
		<rule name="discard" />
	</input>

	<input name="nome-igreja-origem" label="Igreja de origem">
		<rule name="discard" />
	</input>
	<input name="telefone-igreja-origem" label="Telefone igreja de origem">
		<rule name="discard" />
	</input>
	<input name="pastor-igreja-origem" label="Pastor igreja de origem">
		<rule name="discard" />
	</input>
	<input name="nome-antigo-ministerio" label="Nome antigo ministerio">
		<rule name="discard" />
	</input>
	<input name="experiencia" label="Experiência outra igreja">
		<rule name="discard" />
	</input>

	<input name="possui-ministerio" label="Possui ministério">
		<rule name="discard" />
	</input>
	<input name="interesse-ministerios" label="Ministérios">
		<rule name="discard" />
	</input>

	<input name="estado-civíl" label="Estado civil">
		<rule name="discard" />
	</input>
	<input name="nome-conjuge" label="Nome do conjuge">
		<rule name="discard" />
	</input>
	<input name="nome-pai" label="Nome do pai">
		<rule name="discard" />
	</input>
	<input name="nome-mae" label="Nome da mãe">
		<rule name="discard" />
	</input>

	<input name="cep" label="CEP">
		<rule name="cep" />
		<rule name="required" />
	</input>
	<input name="logradouro" label="Logradouro">
		<rule name="discard" />
		<rule name="required" />
	</input>
	<input name="numero" label="Numero">
		<rule name="number" />
		<rule name="discard" />
	</input>
	<input name="complemento" label="Complemento">
		<rule name="discard" />
	</input>
	<input name="uf" label="UF">
		<rule name="number" />
		<rule name="required" />
	</input>
	<input name="bairro" label="Bairro">
		<rule name="discard" />
		<rule name="required" />
	</input>
	<input name="cidade" label="Cidade">
		<rule name="number" />
		<rule name="required" />
	</input>

	<input name="arquivo" label="">
		<rule name="discard" />
	</input>
	<input name="nome-arquivo" label="">
		<rule name="discard" />
	</input>

	<input name="nome-filho" label="Nome do filho">
		<rule name="discard" />
	</input>
	<input name="estado-civil" label="Estado civil">
		<rule name="discard" />
	</input>
	<input name="filho-cristao" label="Filho é cristão">
		<rule name="discard" />
	</input>
	<input name="nascimento-filho" label="Data de nascimento do filho">
		<rule name="discard" />
	</input>
</form>