<?xml version="1.0" encoding="UTF-8"?>
<!DOCTYPE settings SYSTEM "http://optimuz.interativadesenvolvimento.com.br/dtd/validation.dtd">
<form method="post" lang="">
	<input name="nome" label="Nome">
		<rule name="required" />
	</input>
	<input name="cadastro" label="Cadastro">
		<rule name="required" />
	</input>
	<input name="id" label="ID">
		<rule name="required" />
		<rule name="number" />
	</input>
	<input name="nivel-superior" label="NÃ­vel Superior">
		<rule name="discard" />
		<rule name="number" />
	</input>	
	<input name="campos-auxiliares" label="">
		<rule name="discard" />
	</input>	
</form>