<?xml version="1.0" encoding="UTF-8"?>
<!DOCTYPE settings SYSTEM "http://optimuz.interativadesenvolvimento.com.br/dtd/validation.dtd">
<form method="post" lang="">
	<input name="id" label="Id do podcast">
		<rule name="required" />
		<rule name="number" />
	</input>
	<input name="titulo" label="Nome fantasia">
		<rule name="required" />
	</input>
	<input name="descricao" label="RazÃ£o social">
		<rule name="required" />
	</input>
	<input name="igrejas" label="Lugar a apresentar">
		<rule name="array" />
		<rule name="required" />
	</input>
	<input name="arquivo" label="">
		<rule name="discard" />
	</input>
	<input name="nome-arquivo" label="">
		<rule name="discard" />
	</input>
	<input name="status" label="">
		<rule name="required" />
	</input>
</form>