<?xml version="1.0" encoding="UTF-8"?>
<!DOCTYPE settings SYSTEM "http://optimuz.interativadesenvolvimento.com.br/dtd/validation.dtd">
<form method="post" lang="">
	<custom-rules>
		<rule name="coordenada" regex="/-?\d+(\.\d+),-?\d+(\.\d+)/" errorMessage="Este campo requer valores de coordenadas" />
		<rule name="long" regex="/^-?\d+(\.\d+)?$/" errorMessage="A longitude não foi informada corretamente" />
		<rule name="lat" regex="/^-?\d+(\.\d+)?$/" errorMessage="A latitude não foi informada corretamente" />
	</custom-rules>
	<input name="titulo" label="Título">
		<rule name="discard" />
	</input>
	<input name="data-inicio" label="Data de início">
		<rule name="date" />
		<rule name="compareDates" second="data-fim" />
	</input>
	<input name="data-fim" label="Data de término">
		<rule name="date" />
	</input>
	<input name="descricao" label="Descrição da Pesquisa">
		<rule name="discard" />
	</input>
	<input name="quantidade-pontos" label="Quantidade de pontos">
		<rule name="required" />
	</input>
	<input name="tipo-pesquisa" label="Tipo de pesquisa">
		<rule name="required" />
	</input>
	<input name="pesquisa-anonima" label="Pesquisa anonima">
		<rule name="required" />
	</input>

	<input name="sexo" label="Sexo">
		<rule name="required" />
	</input>
	<input name="idade-minima" label="Idade Mínima">
		<rule name="required" />
	</input>
	<input name="idade-maxima" label="Idade Máxima">
		<rule name="required" />
	</input>

	<input name="text-question" label="">
		<rule name="discard" />
		<rule name="array" />
	</input>
	<input name="type-response" label="">
		<rule name="discard" />
		<rule name="array" />
	</input>
	<input name="category" label="">
		<rule name="discard" />
		<rule name="array" />
	</input>
	<input name="options" label="">
		<rule name="discard" />
		<rule name="array" />
	</input>
	<input name="required" label="">
		<rule name="discard" />
		<rule name="array" />
	</input>
	<input name="exception" label="">
		<rule name="discard" />
	</input>
	<input name="trigger" label="">
		<rule name="discard" />
	</input>
</form>