<?xml version="1.0" encoding="UTF-8"?>
<!DOCTYPE settings SYSTEM "http://optimuz.interativadesenvolvimento.com.br/dtd/validation.dtd">
<form method="post" lang="">
	<custom-rules>
		<rule name="cep" regex="/\d{5}-\d{3}/" errorMessage="O formato do CEP deve ser 00000-000" />
	</custom-rules>

	<input name="titulo" label="Nome fantasia">
		<rule name="required" />
	</input>
	<input name="data" label="Data">
		<rule name="required" />
	</input>
	<input name="hora" label="Data">
		<rule name="required" />
	</input>
	<input name="titulo" label="Nome fantasia">
		<rule name="required" />
	</input>
	<input name="descricao" label="Razão social">
		<rule name="required" />
	</input>
	<input name="igrejas" label="Lugar a apresentar">
		<rule name="array" />
	</input>

	<input name="arquivo" label="">
		<rule name="discard" />
	</input>
	<input name="nome-arquivo" label="">
		<rule name="discard" />
	</input>

	<input name="cep" label="CEP">
		<rule name="cep" />
		<rule name="required" />
	</input>
	<input name="logradouro" label="Logradouro">
		<rule name="discard"/>
		<rule name="required" />
	</input>
	<input name="numero" label="Número">
		<rule name="number" />
	</input>
	<input name="complemento" label="Complemento">
		<rule name="discard" />
	</input>
	<input name="uf" label="UF">
		<rule name="number" />
		<rule name="required" />
	</input>
	<input name="bairro" label="Bairro">
		<rule name="discard"/>
		<rule name="required" />
	</input>
	<input name="cidade" label="Cidade">
		<rule name="discard"/>
		<rule name="required" />
	</input>
</form>