<?xml version="1.0" encoding="UTF-8"?>
<!DOCTYPE settings SYSTEM "http://optimuz.interativadesenvolvimento.com.br/dtd/validation.dtd">
<form method="post" lang="">
	<custom-rules>
		<rule name="phone" regex="/\d{2} \d{4,5}-\d{4}/" errorMessage="O formato do telefone deve ser 00 0000-0000" />
		<rule name="cep-rule" regex="/\d{5}-\d{3}/" errorMessage="O formato do cep deve ser 00000-000" />
	</custom-rules>
	<input name="nome" label="Nome">
		<rule name="required" />
	</input>
	<input name="telefone" label="Telefone">
		<rule name="phone" />
	</input>
	<input name="nivel" label="Nível">
		<rule name="number" />
	</input>
	<input name="permissoes" label="Permissões">
		<rule name="array" errorMessage="Selecione uma ou mais permissões" />
		<rule name="discard" />
	</input>
	<input name="id" label="ID do usuário">
		<rule name="required" />
		<rule name="number" />
	</input>
	<input name="filial" label="Filiais">
		<rule name="array" errorMessage="Selecione uma ou mais filiais" />
		<rule name="discard" />
	</input>

</form>